date,header,rating,content,Seat Type,Value For Money,Recommended,id,Seat Comfort,Cabin Staff Service,Food & Beverages,Inflight Entertainment,Type Of Traveller,Aircraft,Route,Date Flown,Ground Service,Wifi & Connectivity,airline_name,country
2016-03-14,"""ambience was pleasant""",5,Overall experience with Indigo flight from Delhi to Pune is good compared to others which I have travelled. Cabin space and seating arrangement is better than others. Overall ambience was pleasant. I think Indigo could enhance their service by adding some information devices inside the cabin showing a route map and if possible some outside coverage such as cameras. They could also offer Indian food during meal times rather than junk food.,Economy Class,3,yes,136,4,4,2,1,Business,A320,DEL to PNQ,March 2016,3,1,IndiGo,India
2016-03-20,"""flight experience  was good""",10,The overall flight experience from Delhi to Visakhapatnam via Hyderabad was good compare to other airlines.The seats were comfortable and spacious. The food was nice but there was no In Flight entertainment.I suggest Indigo to Have InFlight entertainment.,Economy Class,5,yes,137,5,5,,1,Family Leisure,A320,DEL to VTZ via HYD,March 2016,5,,IndiGo,India
2016-03-22,"""flight experience always been good""",9,"Pune to Lucknow via New Delhi. I have flown every low cost airline in India and I find Indigo the best. Their booking is hassle free through app on both ios and android. Web check-in is a breeze, getting any optional services is also good. The check-in is curteous and to the point. Mind you they dont allow even 1kg extra on planes without payment, plus they have also started to screen weight of cabin bag just before boarding the flight. Its a business model because they are a budget airline. The planes are clean with courteous crew. The leg space of economy seats is ample. I am a heavy built person and I have never faced space crunch in the seats. The in-flight food is okay, nothing to write about. I never had to wait for my baggage for more than 10 min. Overall the flight experience has always been good.",Economy Class,5,yes,138,4,5,2,,Solo Leisure,A320,PNQ to LKO via DEL,February 2016,5,,IndiGo,India
2016-05-10,"""seats not that comfortable""",4,"✅ Verified Review |  Cochin to Delhi with IndiGo, flight was late by 1 hour due to incoming aircraft arriving late.  Seat was 13E(XL). Seats not that comfortable and cushioning is very hard. Had the instant noodles which was tasty along with Cappuccino which is always hot and tasty. Service was okay. At DEL, baggage took a long time to come.",Economy Class,2,no,139,1,3,4,,Business,A320,COK to DEL,April 2016,1,,IndiGo,India
2016-05-11,"""worst experience so far""",1,"✅ Verified Review | Delhi to Hyderabad with IndiGo. While I'm writing this, I'm waiting to make the payment for excess luggage. The problem is, it's been 40 minutes, and having been moved from one counter to another, three times, I'm still stuck in a state wondering if I'll ever get my boarding pass for an already delayed flight. I've travelled on pretty much every domestic airline that operates in India. This is my worst experience so far. Unlikely I'll ever buy a ticket with Indigo again.",Economy Class,3,no,140,2,3,3,3,Business,,DEL to HYD,May 2016,1,3,IndiGo,India
2016-07-09,"""a pleasure flying with IndiGo""",10,✅ Verified Review | Flew from Mumbai to Bhubaneswar with IndiGo. The flight arrived and departed on time. The interior is also well maintained and the seats are quite comfortable. The cabin crew are very polite and listens to one's problem very patiently. The landing was a smooth one and the pilot kept us well-informed about the delays. The food was delicious and it was a very enjoyable flight. I will have a pleasure flying with IndiGo again.,Economy Class,5,yes,141,5,5,5,,Family Leisure,A320,BOM to BBI,March 2016,5,,IndiGo,India
2016-07-28,"""punctual and crews very attentive""",8,"✅ Verified Review |  Delhi to Bangalore return with IndiGo. Used the airline twice in the month. Very punctual and crews very attentive, which makes the service very pleasing. Expanded food menu is a good development. The seats are a let down though , as it is not comfortable for a six-footer like me and that when journey is almost 2.5 hours.",Economy Class,5,yes,142,1,4,4,,Business,A320,DEL to BLR,July 2016,5,,IndiGo,India
2016-07-30,"""crew have a very welcoming nature""",10,✅ Verified Review |  Jammu to Mumbai via Srinagar with IndiGo. It was a very pleasant flight and the cabin crew have a very welcoming nature. Cleanliness is well-maintained in all the aircrafts and the food tasted fantastic. The landing and takeoff are very smooth all the time. The restrooms do not smell like other airlines and the overall flight experience was amazing. I will definitely opt for it again.,Economy Class,5,yes,143,5,5,5,,Business,A320-232,IXJ to BOM via SXR,July 2016,5,,IndiGo,India
2016-09-10,"""best domestic airline of India""",10,✅ Verified Review |  Mumbai to Bangalore. IndiGo is the best domestic airline of India. The seats were very comfortable and the food was excellent. The cabin crew were polite and had a welcoming nature. The pilot kept us well-informed about the delays. The Takeoff and landing was a smooth one. I had an amazing experience with this airline and would keep on travelling with them.,Economy Class,5,yes,144,5,5,5,,Solo Leisure,A320,BOM to BLR,September 2016,5,,IndiGo,India
2016-09-11,"""flight experience was fantastic """,10,✅ Verified Review |  Flew from Mumbai to Bangalore with IndiGo. As we entered the aircraft we were warmly welcomed. Though we had to buy food but it didn't create any issues. The food tasted fantastic and seats were quite comfortable. The cabin crew was polite.  Overall flight experience was fantastic and I would keep travelling with them.,Economy Class,5,yes,145,5,5,5,,Family Leisure,A320,BLR to BOM,September 2016,5,,IndiGo,India
2016-09-22,"""overall experience is awesome""",10,✅ Verified Review |  Bangalore to Mumbai. Every time I travel with IndiGo I have no complaints with it. The cabin crew are polite and have a welcoming nature. Followed by the warm welcome was the smooth takeoff. The legroom was fantastic and the seats also wide enough. The food was hot and delicious. The landing was a smooth one and the overall experience is awesome.,Economy Class,5,yes,146,5,5,5,,Solo Leisure,A320,BLR to BOM,September 2016,5,,IndiGo,India
2016-09-23,"""overall flight was very enjoyable""",10,"✅ Verified Review |  Mumbai to Goa by IndiGo. Check-in was quite easy. We were warmly welcomed by the cabin crew. Cleanliness had been maintained on this aircraft. The seats were very comfortable and the legroom was fantastic. The overall flight was very enjoyable, and I will have a pleasure flying with IndiGo again.",Economy Class,5,yes,147,5,5,5,,Solo Leisure,A320,BOM to GOA,February 2016,5,,IndiGo,India
2016-09-26,"""a great flight experience""",10,✅ Verified Review | Flew from Mumbai to Bangalore with IndiGo. The check-in was good and everything went smoothly. The flight departed and arrived on-time. The cabin crew are very polite. The cushioning of the seat was hard but it didn't create any issues. The food was served hot and was very delicious. Had a great flight experience with IndiGo.,Economy Class,5,yes,148,5,5,5,5,Solo Leisure,A320,BOM to BLR,September 2016,5,,IndiGo,India
2016-10-29,"""staff was nice and helpful""",9,"✅ Verified Review |  Great airline. I had 3 domestic flights with Indigo: Udaipur-Mumbai, Mumbai-Goa and Goa-Delhi. Booking in its website was easy and prices were competetive. Check-in at the airports was easy and fast - Indigo had many counters open in all 3 airports. Flights departured with no delays of more than 5 minutes. The airplanes looked new and very clean. Staff was nice and helpful. On two occasions I ordered a sandwich (about 250 rupees) which was quiet tasty to my surprise. The only downside that I can think of is that the seats are not very comfortable, but it's a low cost airline and flights usually last only 1-2 hours, so it's not such a big deal. Highly recommended.",Economy Class,5,yes,149,3,5,4,,Solo Leisure,,GOI to DEL,October 2016,5,,IndiGo,India
2016-10-31,"""personal favourite for short flights""",6,"Ranchi to Kolkata with IndiGo. I travel frequently with this airline, and trust me folks this is the best you can get in terms of value for money compared to other airlines in India. Indigo has been my personal favourite for short flights. The flight crew is fairly good. I'm 6'1, and I find the seat compact but this is the same for all LCCs and not ideal on long flights. Cabin staff appearance is smart, they are courteous but not always consistent. There is no inflight entertainment on these flights. Short flights they are perfect, Medium duration okay, long flights not recommended.",Economy Class,4,yes,150,2,4,3,,Family Leisure,A320,IXR to CCU,August 2016,4,,IndiGo,India
2016-11-03,"""disappointing and sad experience""",5,"✅ Verified Review | Indigo Mumbai to Delhi return. The outward journey started with a smooth and easy check in at Mumbai. Flight on time. The aircraft was clean and as per Indigo standards. What was very poor on this flight was the crew. The leading stewardess in particular seemed to sit and do not much while the other crew worked. Shame to see Indigo crew standards falling. It was also a morning flight but they had none of the breakfast options available - Ramen noodles were my best option. Return flight had a great crew but the Delhi airport check in was a nightmare. Long lines, people cutting lines. No Indigo crew to help. Quite a disappointing and sad experience. The days of looking for Indigo flights to book may be over.",Economy Class,3,no,151,4,2,1,,Business,A320,BOM to DEL,October 2016,2,,IndiGo,India
2016-11-15,"""staff truly inexperienced""",5,"Bangalore to Nagpur with IndiGo. On this trip to India, I was fortunate enough to try 3 different airlines - Air India, Jet Airways and Indigo. Indigo definitely scored best in terms of its modern fleet, however not recommended for international passengers due to its baggage restrictions. The fares aren't that cheap compared to other airlines, however Air India allows the most baggage weight. The staff are young and attractive, but truly inexperienced to handle situations. Personally didn't have a choice, since IndiGo had so many direct flights to remote cities.",Economy Class,4,yes,152,3,2,1,,Business,,BLR to NAG,July 2016,4,,IndiGo,India
2016-11-17,"""inflight service impeccable""",8,"Another flawless flight. Flew Bangkok to Pune via Kolkata with IndiGo. On time, both departures and both arrivals. Smooth boarding from Bangkok. Impeccable onboard service und attitude. Chaotic boarding at Kolkata: a long queue formed at boarding. Fine. Then an announcement was made by a ground staff member, in a voice that could barely be heard that rows 16-30 would board first. Since the announcement was barely audible, people waiting in the queue were confused, thus standing in line, not knowing what to do. Ground crew member - only one IndiGo staff manning their pre-boarding desk/area - did not repeat announcement and just stood by looking around and not allowing anyone to board. People waiting. In the meantime some passengers not in the queue approached this confused ground staff person, spoke to him and were allowed to board. No idea if these people were going to occupy rows 16-30. Nothing happening; line not moving; IndiGo staff still looking as if he was in a daze. No repeat announcement, in an audible voice, re rows 16-30. Since I was in line, had a seat in row 21, I broke the queue, presented my boarding pass, and passed security. Don't know what happened after that. IndiGo needs to get its act together in this area. Inflight service again impeccable.",Economy Class,5,yes,153,4,5,,,Solo Leisure,A320,BKK to PNQ via CCU,November 2016,3,,IndiGo,India
2016-11-18,"""a loyal traveller with IndiGo""",9,✅ Verified Review |  Delhi to Port Blair via Kolkata. IndiGo used to be my best option because of its on time schedule. But due to a few problems and  delays I chose other options like Vistara. On 12th November 2016 I again chose IndiGo for a family holiday in Port Blair from Delhi. I was very happy and satisfied with all the services. Even the flight was ahead of its schedule and the cabin crew was warm and the hospitality was just amazing. I'm again a loyal traveller with IndiGo now.,Economy Class,5,yes,154,4,5,5,,Family Leisure,A320,DEL to IXZ via CCU,November 2016,4,,IndiGo,India
2016-12-08,"""did not have Thai immigration forms""",9,"Yet another comfortable, friendly and smooth IndiGo flight flying from Pune to Bangkok via Kolkata. A caveat: In a hundred international flights into Bangkok in the past two decades, for the first time ever in my experience, an airline (IndiGo) did not have Thai immigration forms. Anybody who has been through immigration at Suvarnbhumi expects a wait of up to one hour. So, to not have immigration forms on board a flight can develop into an even longer wait. Come on, IndiGo! Otherwise, as usual, a flawless IndiGo flight.",Economy Class,5,yes,155,3,5,,,Solo Leisure,A320,PNQ to BKK via CCU,December 2016,5,,IndiGo,India
2016-12-20,"""only as a last option""",1,"✅ Verified Review | I have been having consistent horrible experiences with Indigo regarding delays. I was travelling from Cochin to Bangalore - the flight was supposed to depart at 8.45 pm and it departed the next morning at 2.05 am. A week later, I was returning from Trivandrum to Bangalore - the flight was supposed to depart at 8.15 pm and it departed the next morning at 12.05 am. Today, my wife was supposed to travel to Chennai from Bangalore. The departure time is 7.20 am, the revised departure is at 9:15 am. Indigo used to be consistently punctual. When I speak to the staff, I hear that the fleet is overbooked and you are trying to optimize. I will look at Indigo only as a last option.",Economy Class,1,no,156,3,3,3,,Business,,COK to BLR,December 2016,1,,IndiGo,India
2016-12-23,"""on time and comfortable""",8,"✅ Verified Review | Delhi to Hyderabad with IndiGo. My flight was cancelled and I was moved to another flight. Apart from this, everything was good apart from the cost of the meals. I didn't find the coffee and noodles too special and weren't great. New flight was on time and comfortable. Not much to talk about but was good as far as the budget airline tag goes.",Economy Class,3,yes,157,4,3,4,,Solo Leisure,A320,DEL to HYD,December 2016,4,,IndiGo,India
2017-01-02,"""handling of baggage was horrible""",1,✅ Verified Review | Hyderabad to Chennai. I had the worst experience flying with IndiGo airlines. The flight was delayed by 2 hours and adding to that handling of baggage was horrible. Baggage of 6 flights was released on a single belt at the same time. It took almost 1 hour to find the baggage and to find the baggage I had to make my way through 1000s of passengers waiting for their baggage. When contacted customer service they didn't have the contact info of IndiGo go personal in the airport.,Economy Class,1,no,158,4,3,,,Family Leisure,,HYD to MAA,January 2017,1,,IndiGo,India
2017-01-14,"""good on-time airline""",9,✅ Verified Review | IndiGo is my preferred airline on the Dubai to Mumbai route - especially when not carrying checked in baggage. Good on-time airline and good flight timings. Courteous and mostly well trained staff - no inflight entertainment. Food and drinks paid as it's a budget airline.,Economy Class,5,yes,159,4,5,3,1,Solo Leisure,,BOM to DXB,December 2016,4,1,IndiGo,India
2017-01-21,"""they divide our family""",2,"✅ Verified Review |  Rachi to Vadodara via Delhi. One day prior to my flight IndiGo changed my flight time, and worst part they divided our family of four into 3 and 1. Three of us has one flight and time and single member has another flight with a different time for the same destination on the same day. And when I was travelling many seats were vacant, why they didn't know.",Economy Class,2,no,160,2,4,,3,Family Leisure,A320,IXR to BDQ via DEL,January 2017,3,,IndiGo,India
2017-01-30,"""not value for money""",2,"✅ Verified Review |  Indore to Delhi. Staff at airport are pretty rude, I had 1 check-in luggage and no hand luggage. My check-in luggage weight was 16.7kg. That lady was asking me to pay and when I said that I am not carrying any hand luggage still they said you can take out stuff and carry on hand luggage. I have been traveling with IndiGo for 7 years, they are getting worse and not value for money.",Economy Class,1,no,161,1,1,,,Solo Leisure,,Indore to Delhi,January 2017,1,,IndiGo,India
2017-02-17,"""cabin seemed neat and clean""",10,"✅ Verified Review | Flew from Mumbai to Bhubaneswar with IndiGo. It was the first time I was traveling in an A320neo aircraft so was quite excited about it. At the airport check-in was done smoothly without standing in any queue. While boarding the aircraft the cabin crew welcomed us with their smiling faces. The aircraft cabin seemed neat and clean. The lavatories were clean. The seats were quite comfortable and wide. The legroom was quite good. The food menu consisted of sandwiches, instant biryanis as well as instant noodles. I decided to go for sandwiches. They tasted good. The flight departed on time but arrived 20 minutes before the scheduled time of arrival. Really it was a pleasure traveling with them.",Economy Class,5,yes,162,5,5,5,5,Business,A320,Mumbai to Bhubaneswar,December 2016,5,,IndiGo,India
2017-02-17,"""recommend this airline""",10,✅ Verified Review |  Bengaluru to Mumbai by IndiGo Airlines. The check-in was quite comfortable. We were welcomed warmly by the cabin crew while boarding the aircraft. The aircraft seemed clean as compared to other airlines in India. The lavatories were also well maintained without any faul smell. The seats had a very soft cushioning hence it made quite a comfortable journey for us and were also wide. Though we had to buy food but it did not create any issues. Their food tasted fantastic. The flight departed and arrived on time. The landing and takeoff were very smooth. I recommend this airline and always a pleasure.,Economy Class,5,yes,163,5,5,5,5,Solo Leisure,A320,Bengaluru to Mumbai,September 2016,5,5,IndiGo,India
2017-03-23,"""departure and arrival was on time""",8,"✅ Verified Review |  
Flew IndiGo from Jaipur to Kolkata. Take off and landing was smooth. Departure and arrival was on time. Seats were comfortable. Check-in was done smoothly. While boarding the aircraft the cabin crew welcomed us but not with their smiling faces. When I saw the air hostess serving water I asked for a glass of water, she didn't give me one but instead carried on serving water to other passengers even though I had asked before anyone else. On asking again twice, she replied twice ""I'll come back"". After that, I was given glass of water.
",Economy Class,5,no,164,5,3,,,Solo Leisure,,Jaipur to Kolkata,March 2017,5,,IndiGo,India
2017-05-21,"""comfort might be a difficulty""",4,"✅ Verified Review |  Delhi to Mumbai on Indigo Airbus A321. Had taken this evening flight and as we had checked in online, we went to the airport directly. However, it was observed that we still had to get a copy of the boarding pass from the check in kiosks which was surprising because normally with the online boarding passes, there should not be any need to get the printout from the kiosks. This issue was not observed in my previous flight with another airline. The flight was on time with just a slight 10 minute delay in departure. The seats onboard were slightly cramped and if someone has a slightly bigger frame, then comfort might be a difficulty. As this is a low cost carrier, meals and snacks such as sandwiches (both veg and non-vegetarian), tea/coffee and cup noodles were offered. As I had booked this flight with a corporate meal, a chicken sandwich and juice was offered 30 minutes after takeoff. The sandwich was a bit on the colder side but tasty nevertheless and the juice was also given in a can. After the snack, unfortunately the passenger in front of me had reclined his seat so as a result, it got even more cramped. To be fair to the crew, they were quite presentable and they performed their tasks with great efficiency. Flight was on time and while exiting the aircraft, the crew were quite polite and thanked the passengers. The positive was the crews friendly attitude and efficiency. On the downside perhaps it can be said that if one is of a bigger frame, the conditions can get slightly cramped and so on longer flights this can be a problem. Their in-flight magazine Hello 6E had some articles but was by and large, an in-shop magazine. Would I fly with them again? Maybe on very short routes which are dirt cheap, but would rather prefer the full service carriers instead.",Economy Class,3,no,165,2,4,2,2,Solo Leisure,A320,Delhi to Mumbai,May 2017,3,,IndiGo,India
2017-06-01,"""the flight crew were good""",5,"✅ Verified Review |  Flew IndiGo from Bhubaneswar to Chennai. Travel was good, the flight crew were good too. The flight was on time. However there a strange high pitched sound just before take off which lasted for 5-10 minutes and the AC stopped working until the flight took off. The sound was again heard during landing too. The baggage at conveyer belt after the flight landed was messed up. On the same belt there was back to back baggage for 3 flights which was cumbersome and troublesome. I had to stand at the belt for an hour waiting to receive my luggage, it was very crowded with people looking for bags. Ground service was poor.",Economy Class,3,no,166,3,3,,,Family Leisure,,Bhubaneswar to Chennai,May 2017,1,,IndiGo,India
2017-06-30,"""it was a comfortable flight""",9,"✅ Verified Review |  Delhi to Varanasi. This was my first flight with IndiGo and I was accompanied with my sister and her three children (2 kids and 1 infant). At Check-In we were given priority due to family. I was informed that they won't be able to accommodate us in one row as the seats were full. On my request, the Lady at the counter talked to her Supervisor and allotted us seats in the first row (which are paid seats) without any extra fee. That was really surprising and too generous of them. The boarding was smooth, the aircraft was clean and the food (paid) was good. It was a comfortable flight with very attentive and hospitable cabin crew. Even the ground staff was very helpful and courteous. The flight was on time and luggage reclaim was almost smooth. IndiGo definitely lived up-to it's tagline of on-time budget airline. Would definitely love to fly it again.",Economy Class,5,yes,167,4,5,3,,Solo Leisure,A320-200,Delhi to Varanasi,March 2017,5,,IndiGo,India
2017-07-05,"""best domestic airline in India""",9,"✅ Verified Review |  Kolkata to Hyderabad. It is the best domestic airline in India with best prices and the most punctual one. It is seldom late so I have never been in problem due to late arrivals as I mostly travel in late night flights. Food is basically paid one but I have never tried anytime. They consist of mainly ready to eat meals like cup-noodles, biriyani, sandwiches.",Economy Class,5,yes,168,5,5,,,Solo Leisure,A320,Kolkata to Hyderabad,June 2017,5,,IndiGo,India
2017-07-20,"""delayed by 2.30 hours""",1,✅ Verified Review | The flight from Delhi to Ahmedabad was delayed by 2.30 hours in the night. Scheduled departure was at 10.40 pm and actual departure is 12.50 pm. This was my second worst experience within a fortnight period with IndiGo. They just give the reason of technical glitch and no alternate arrangements are there.,Economy Class,1,no,169,1,1,1,1,Business,,Delhi to Ahmedabad,July 2017,1,1,IndiGo,India
2017-07-21,"""no Arrival Cards onboard""",9,"✅ Verified Review |  Bangkok to Pune via Kolkata. As  faultless flight except for a long-standing problem: no Arrival Cards onboard the flight for foreign nationals thus delaying, on arrival in Calcutta the immigration process. Repeated requests over these past many years have yielded no positive result.",Economy Class,5,yes,170,4,5,,,Solo Leisure,A320,Bangkok to Pune via Kolkata,July 2017,5,,IndiGo,India
2017-08-02,"""No through check-in""",3,"✅ Verified Review |  New Delhi to Muscat via Mumbai was an horrific experience.  I booked Delhi-Muscat ticket on Indigo website. They had a flight via Mumbai where flight was to be changed. The ticket was under single PNR, I confirmed with customer care if the luggage will be through checked in & he confirmed it would be done. But at the time of check in, the officer denied & started asking me the name of person who confirmed. Now, who remembers the name of customer care executive! So, I had to take the luggage in Mumbai & check-in again. With no other option, I did take the luggage. The gap between the 2 flight was of about 3 hours. I was supposed to be transferred to International airport. When I asked the ground staff to arrange transfer, they were clueless & asked me to go out, hire a taxi & leave. I got upset, but instead of helping me, the Mumbai ground staff kept on arguing. The taxi took a good time to reach International airport, as it was peak hour. Finally we could make it just in time only to find that the flight was delayed. This is the first time I have seen that international flight booked under one PNR from an airline website. No through check-in, No transfers,when both the flights are from same airline. Basic flight, No service, No entertainment, expensive Food.",Economy Class,3,no,171,2,4,2,,Family Leisure,,New Delhi to Muscat via Mumbai,October 2016,1,,IndiGo,India
