date,header,rating,content,Seat Type,Value For Money,Recommended,id,Seat Comfort,Cabin Staff Service,Food & Beverages,Inflight Entertainment,Type Of Traveller,Aircraft,Route,Date Flown,Ground Service,Wifi & Connectivity,airline_name,country
2021-07-07,"""obscene cancellation/change fees""",1,"✅ Trip Verified |  I have not flown on this flight yet. It's a future reservation that I have with them, and need to cancel because my onward/return journey between Mumbai and Seychelles that was part of the overall travel itinerary was cancelled due to Covid restrictions in Seychelles for passengers from India. So I need to cancel these IndiGo flights, as I have no need to travel to Mumbai and back now. When I call the customer service line to cancel, I get the following: They mention flight fees and changes on their website but fail to mention that they charge these per passenger per flight/sector when you need make changes or cancellations to your reservation. For a $180 round trip flight booked for my wife and I from Tirupati to Mumbai and back, they were saying I will get a refund of $28 even though I'm canceling almost 2 months in advance. Based on their USD cancellation fee of $45 that should be charged for cancellations made 4+ days before departure, I should receive a $135 refund. Or if they were strictly following this fee applied per person per flight, then that would be $45 per person per way, i.e. $45x4=$180 so I should not receive any refund. But they make an arbitrary calculation that I get $28 refund. They pretend to be a low-cost carrier that's friendly to the middle class in India, but actually charge obscene cancellation/change fees.",Economy Class,1,no,337,,,,,Couple Leisure,,Tirupati to Mumbai,June 2021,,,IndiGo,India
2021-07-13,"""Thank you IndiGo""",10,"✅ Trip Verified |  Yesterday (11 july) I brought my 90 year old mother back and from entry to exit, each member of IndiGo staff provided exemplary care. From wheelchair to security to plane they took genuine care. The surprise started by Sujata politely asking if we would like front row seats, which I had wanted but while booking couldn't get. That gave us comfort in 2 hours flight and Sujata accompanied us through security, which often can be cumbersome. Other staff too helped selflessly. Cabin crew was kind. Covid protocols are followed to a T by IndiGo. In Bengaluru on arrival Keertana helped and escorted all through till exit. It made travel with a near blind, wheelchair bound mother very doable. Thank you IndiGo. Way to go! ",Economy Class,5,yes,338,5,5,5,,Solo Leisure,,Vadodara to Bengaluru,July 2021,5,,IndiGo,India
2021-07-24,"""the seat selection was free""",10,"✅ Trip Verified |  I was pleased to note that during the online check in for this flight, the seat selection was free because in previous experiences of flying with IndiGo, they usually charge a fee of around Rs 150 for selecting a seat. The baggage drop was a smooth process and departure was on time. The crew took steps to check for negative RT-PCR reports or proof of fully vaccinated during the time of boarding which was appreciated. Arrival was on time and IndiGo did the job of transporting from point A to B in a fairly reasonable price for a 1 hour 40 minute flight.",Economy Class,5,yes,339,4,4,,,Couple Leisure,A321 Neo,Bengaluru to Mumbai,July 2021,5,,IndiGo,India
2021-07-26,"""counters had been closed at 7:30""",2,"✅ Trip Verified |  I had a morning flight of 8:30 am from Ahmedabad to Lucknow. I reached the airport at 7:25 am and was standing in the IndiGo line for check-in. Around 7:32 am, the IndiGo lady asked where I was going and other few passengers as well. When we informed her that it was Lucknow, the lady removed us from the line informing us that the counters had been closed at 7:30. She was very stubborn and was not ready to listen or even guide us on what to do next. The next 20 min just flew by running from indigo counter to counter. The lady on the reservation counter didn't even inform me of the fact that if a customer missed their flight and books it via their counter the fee charged is Rps 1800 and the PNR given is the same. A customer doesn't need to restart their booking again. Luckily my husband guided me on this procedure to which the lady confirmed. ",Economy Class,1,no,340,,,,,Solo Leisure,,Ahmedabad to Lucknow via Delhi,July 2021,,,IndiGo,India
2021-08-08,"""one of the top LCCs in Asia""",10,"✅ Trip Verified |  At Mumbai airport, during check in, the staff took care to verify the negative RT PCR reports of all the passengers travelling to Karnataka which was appreciated even though the seat selection during online check in was not free unlike the previous time when I flew which was a surprise. Boarding started well ahead of schedule and it seems that Indigo is deploying with high capacity Airbus A321 Neo aircraft on high density routes to get as much passengers and load as possible. The crew was welcoming and wished everyone during boarding and deboarding which was much appreciated as these small things do matter. The luggage could have perhaps come a bit earlier than expected but apart from that there is nothing much that one can fault IndiGo on because everything was perfect: the fare, the on time arrival, the crews attitude. It has rightly achieved it's status as one of the top LCCs in Asia.",Economy Class,5,yes,341,4,4,,,Couple Leisure,A321 Neo,Mumbai to Bengaluru,August 2021,5,,IndiGo,India
2021-08-14,"""the seat selection was free""",10,"✅ Trip Verified |  When doing the online web check in, I was pleased to note that since I had booked using a corporate fare, the seat selection was free and also I was entitled to 1 complementary snack onboard the flight. The baggage drop process was smooth although due to huge queues at Bangalore airport, the IndiGo staff quickly collected all the bags from the pax in a separate queue which allowed quick deposit of the bags. Boarding started on time and I learnt that for the complementary snack, there was a choice of upma / poha for veg items and chicken noodles for the non veg items along with the choice of a beverage (hot / cold). The sandwiches could not be availed as part of a CPML booking as I found out but the quantity of the items was on a generous side which was appreciated. The flight landed also on time at Kolkata, however the baggage took some time before coming. In the end, I got more for what I paid for including free seat selection and a complementary meal, and got safely to my destination on time. Cannot ask for anything more.",Economy Class,5,yes,342,4,4,4,,Couple Leisure,A320 Neo,Bengaluru to Kolkata,August 2021,5,,IndiGo,India
2021-09-10,"""substandard quality of service""",1,"Not Verified |  Rude staff, substandard quality of service and they will loot your money over excess baggage weight and other surprise fees not warned to the customer beforehand on their website. Their website for example provides the fee for pre booked additional baggage weight but does not mention the fee if excess baggage is found during boarding.",Economy Class,1,no,343,1,1,1,1,Solo Leisure,,Doha to Kannur,September 2021,1,1,IndiGo,India
2021-09-12,"""Indigo must be proud both of you""",9,"Not Verified |  I was late for boarding to Delhi from Gorakhpur airport. I reached at 15:10, my flight was at 15:40. The staff said, I am late, they were not allowing me to board. But with the support of two employees of Indigo Airlines Ruksar and Satendra are really nice people. They understand the situation. The two have been very helpful to me. She insisted on it and gave me my boarding pass. Thanks, Indigo must be proud both of you two.",Economy Class,4,yes,344,4,3,,,Solo Leisure,,Gorakhpur to Delhi,September 2021,4,,IndiGo,India
2021-10-03,"""Keep up the good work""",10,"✅ Trip Verified |  Indigo staff Chirag at the Goa airport saved my day. I was late to board the Goa to Mumbai indigo flight due to a road accident on 2nd October 2021 flight 6E 259 @ 19.50 The boarding gate was closed and I had a connecting flight to London. The lady at the checkin desk was really helpful, she first refused but later checked with Chirag and than it was run run run - he guided me to the boarding gate. Made my London flight on time Can’t thank him the the check in desk staff enough. Saved me from panic attack. In the last 10 days I have travelled at least 5 times with the Indigo. Excellent service from checking to departure. And the best thing is it’s always on time. Keep up the good work",Economy Class,5,yes,345,4,5,,,Family Leisure,,Goa to Mumbai,October 2021,5,,IndiGo,India
2021-11-18,"""flight had no meal supplies""",2,"✅ Trip Verified |  This flight had no meal supplies and I had a meal booked with my ticket.  I was offered cashews & almonds in place of a meal at 8 PM. The Air Hostess told me ""There are more options available but today we don't have any."" This happened when I was sitting in 6th row, I can only imagine what people in 16th or 60th row had.  Why would you charge money for a meal & not provide it? ",Economy Class,1,no,346,2,1,1,,Family Leisure,,Delhi to Bhubabneswar,November 2021,2,,IndiGo,India
2021-11-24,"""we are very disappointed with the airline""",2,"Not Verified |  To start with, we were travelling to Male, Maldives from Cochin using Indigo, we had booked our flight from Cochin to the Maldives and then onwards to Bahrain. The check in counter staff member reacted very differently to us trying to travel telling us we are supposed to book a return flight back to India from the Maldives as per ‘air bubble agreement’, since we didn’t have time to review the reasons mentioned by the airline, we had no choice but to book a return flight to India. This was not enough for the airline, they wanted a direct flight back. We again made our travel agent rebook, while we didn't cancel our flight to Bahrain, since we didn't trust the totally misinformed Indigo staff, we travelled, spent days in the Maldives and travelled to Bahrain without any hassles! We checked and rechecked with Male airport as well, no such rule was there! Wrong information besides being totally un cooperative towards customers, we are very disappointed with the airline, especially as I have never experienced this. We had asked to meet with the manager, instead of asking him to come to talk to us, we were sent to some counter where he was seated fidgeting with his phone, laid back and totally uncooperative. I am not a person who likes writing such reviews but such incidents are very very problematic. Hope Indigo take appropriate action.",Economy Class,5,no,347,2,3,,,Couple Leisure,,Kochi to Male,November 2021,1,,IndiGo,India
2021-11-29,"""could not have asked for anything better""",9,"✅ Trip Verified |  We had to go Indore for a family function and on this particular flight, we had checked in online and as the fare booked was a corporate fare the seat selection was free. At Bangalore airport, there is a separate section where the passengers can just drop off their bags and the staff there ensure that the bags are checked in which seems to be a much faster process and this is something that other airlines can emulate in order to reduce the waiting time in queues. Also another point to note is that even though the kiosk machines were not working and were unable to print the boarding passes, one can use the mobile boarding pass on the mobile phones for security access. This is also something I experienced first hand and was very valuable. The boarding started on schedule and the flight itself was very comfortable and as the booking was a corporate booking, one is entitled to a single meal and a beverage. I selected the paneer masala rice as it was in the afternoon time. The food was pretty decent along with the tea. Staff service was prompt and polite. Arrival was 30 mins ahead of schedule which was appreciated and the crew was wearing a smile on their faces even while de-boarding and thanking the passengers. Overall could not have asked for anything better.",Economy Class,5,yes,348,4,5,4,,Couple Leisure,A320,Bengaluru to Indore,November 2021,5,,IndiGo,India
2021-11-29,"""it's a good time to start checking the weight and size of cabin baggage""",5,"✅ Trip Verified | On the return flight from Indore, the check-in of the luggage was done very swiftly as we reached the airport well ahead of departure. The boarding also started well on time. One thing that was observed was the huge amount of cabin baggage and the size of that baggage was also very big and yet there were no checks related to the hand baggage performed by the airline staff because it seemed that a lot of luggage were exceeding the 7kg limit and also the dimensions. Perhaps time for the airline to start checking hand luggage? The crew instructed the passengers to keep their backpacks under the seats but during take-off it was observed that a lot of passengers were keeping the backpacks on their lap which was a gross safety violation and yet the crew did not enforce the safety policy properly. Being efficient and on time is important, but never at the cost of safety. The flight itself was uneventful with a upma / tea snack provided as part of the corporate fare and reached on time. I appreciate flying with the airline, but customer satisfaction should never come at the expense of safety norms as this would impact any evacuation procedures. Perhaps this is something that should be kept in mind. And also it's a good time to start checking the weight and size of cabin baggage taken on board the aircraft as well to avoid such incidents in the future. The rating is given based on the safety violation of not stowing away the cabin bags under the seat during takeoff but apart from that the flight and crew were really good.",Economy Class,4,yes,349,4,4,4,,Couple Leisure,A320,Indore to Bengaluru,November 2021,5,,IndiGo,India
2022-01-03,"""Really cheap strategy""",1,"Not Verified |  I booked a ticket on Indigo on 03 Jan 22 for 05 Jan 22 Cochin to Dubai at departure time 00.30 local time but after the booking I get an SMS stating the departure time on 05 Jan 22 is 13.00 local time which is a delay of almost 13 hours and do not serve my purpose for the day. Their website had a problem then why should I suffer for it, hence I requested a full refund for which they are not willing to give. I called them and after talking to their customer service for 01 hour or more, she would not give a full refund, neither solve the issue nor let me speak to her manager and wanted me to book for another date. From her I understood that the 04 Jan 22 flight was cancelled and they rescheduled the 05 Jan 22 flight, which I did not want due to the change in timing and fly with another airline as I have to reach on 05 Jan 22 early morning. These guys go by On Time departure and Arrival but none of that is true. So all of you be beware and customer service has a few lines which they repeat for every question and it really annoys you as this is not the right reply in English for a question asked. Pathetic situation to cheat you out of your money as when you cancel they get a free amount of INR 5,500/-. Disgrace to this company and the people who work for it and own it. Really cheap strategy.",Economy Class,1,no,350,1,1,,,Solo Leisure,A320,Cochin to Dubai,March 2021,1,,IndiGo,India
2022-01-30,"""Overall an uneventful flight""",9,Not Verified | I took the flight to Kolkata on IndiGo. The web check in was done smoothly and it must be noted that the seats at the rear are cheaper as compared to those in the front which is strange as they are the same seats.  The baggage drop was done quickly and efficiently at BLR airport. And boarding started well on time. The crew were welcoming during boarding which was good and the arrival and baggage collection was also Swift. Overall an uneventful flight which took me from point A to B without too much fuss.,Economy Class,5,yes,351,4,4,,,Couple Leisure,A320 neo,Bengaluru to Kolkata,January 2022,5,,IndiGo,India
2022-02-10,"""This is unorganised!""",4,"✅ Trip Verified | Only 15 kilograms check in luggage! Charge extra for everything, demanding 200 rupees for not checking online although the link didn't work. Demanded extra for an extra couple of kilos. Not assigning empty seats for customers, rather than cramping them together and leave empty seats at the back empty, just because they didn't pay for these seats! This is unorganised! No food on the plane, Air India was exactly the opposite of this, nice seat, 25 kilos of luggage, which is more than enough, ultra smooth check-in and offered a sandwich and a drink on just 1 hour flight.",Economy Class,2,no,352,3,4,3,1,Solo Leisure,,Bengaluru to Bhopal,February 2022,1,,IndiGo,India
2022-02-27,"""don't expect any support""",4,"✅ Trip Verified |  I originally intended to give IndiGo a good revues, as I've been travelling India for 2 months and their service was fine for the most part. However, in the last week the airline has had 2 major mishaps which have completely unravelled my travels and I felt compelled to warn other travellers. Firstly, they didn't inform travellers that Nepal requires an exit PCR test in order to leave the country. Of course, you could argue that it's up to the traveller to check requirements but all the all focus is always on entry requirements for the destination country. I've travelled throughout covid and Nepal was the first country I went to requiring an exit test. Any other airline would have sent an email letting their customers know, but not IndiGo. As a result, there was chaos at the airport and I missed my flight, along with 10 others. I flew the next day Kathmandu to Chennai (after paying 10000 rupees fare difference) with a short layover in Delhi. I was assured by IndiGo staff at check in that my bag would go straight through to Chennai, and they put Chennai as the final destination on the baggage ticket, so there was no reason for me to go to baggage collection in Delhi. Upon arrival in Chennai at 1am after a delayed departure, I was told my bag hadn't arrived because I was supposed to have cleared customs at Delhi Airport. It's now been 3 days, my bag is still in Delhi and IndiGo have no idea what's going on. They don't even know the right number to call at Delhi Airport to get an update. At the end of the day, fly IndiGo if you want a cheap flight and can count on things going according to plan, but don't expect any support if there are any disruptions as they don't appear to have the customer's best interests at heart.",Economy Class,4,no,353,4,3,3,,Solo Leisure,,Kathmandu to Delhi via Chennai,February 2022,4,,IndiGo,India
2022-03-07,"""all seats shown as occupied""",1,"Not Verified |  I was travelling with my infant and wife, so tried to do web check-in so that we can get seats together, however all seats shown as occupied. So I reached the airport 2.5 hr prior to get seats together. I waited 15 min in queue then requested same to counter. She sent me to a different counter then again waited for 15min in a queue, then finally she said, we couldn't do it, so we were given 28A which having a baby seat also, you keep your baby in the baby seat and request co passenger for interchange. We couldn't find baby seat there, same thing asked to airhostess, she replied, there is no baby seat. They didn't even gave the baby belt, which is mandatory. Airline not for babies.",Economy Class,1,no,354,1,1,2,1,Family Leisure,,Guwahati to Banglore,March 2022,3,1,IndiGo,India
2022-03-30,"""last time I will fly with Indigo""",1,"✅ Trip Verified |  This is for the last time I will fly with Indigo. I had to ask for water (forget anything else), forget choosing free seats. The lights were very dim, making reading impossible. Last time in November 2021 I flew with Indigo from Mumbai to Kolkata. I booked about 20 days or so in advance. Thrice my flight was rescheduled and I had to change my entire programme. I paid extra for a window seat. ",Economy Class,1,no,355,1,1,1,,Solo Leisure,,Mumbai to Chennai,March 2022,1,,IndiGo,India
2022-03-31,"""recent experience was a fantabulous one""",8,"✅ Trip Verified |  While Indigo does boast about its on time departure and pre time arrival, I don't think that is what makes it the best airline. I have never liked the attitude of many Air Hostesses on this airline, as I have always found them on the edge of being rude. However, my recent experience was a fantabulous one and I need to appreciate two women, who made this journey a happy one. Joyce - Based at the Indigo counters in Hyderabad, automatically upgraded my seat from 4C to 1C, seeing that I am a tall man and would have issues in the back seats. Janett - Air hostess on the flight 6E - 796, departure time 1950, dated 30.3.22. She was extremely hospitable and showed all signs of a great hospitality professional. She was kind, understanding and spoke to all passengers in a polite manner.",Economy Class,4,yes,356,3,5,3,,Business,,Hyderabad to Chandigarh,March 2022,4,,IndiGo,India
2022-04-03,"""very professional and polite""",10,✅ Trip Verified |  The team of Indigo is very professional and polite from Wheelchair to checkin. Special thanks to Miss Manisha Kaim for such a super fast check in. Indigo should proud to have team members like her.,Economy Class,5,yes,357,5,5,5,,Family Leisure,,Delhi to Udaipur,April 2022,5,,IndiGo,India
2022-04-11,"""how good and tolerant the flight crew were""",8,Not Verified |  Chandighar to Goa. Flight was fully booked and was good. Only thing to spoil it was parents note-taking responsibility for their kids. I was amazed how good and tolerant the flight crew were. I certainly wouldn't have been. Flight we were on was a all female crew from captain to stewardess.,Economy Class,5,yes,358,4,5,,,Couple Leisure,A320,Chandighar to Goa,March 2022,5,,IndiGo,India
2022-04-15,"""made to pay Rs.200 for not web checkin""",2,✅ Trip Verified |  Web checkin info is unclear and passenger is made to pay Rs.200 for not web checkin.  International travellers are not allowed to carry more then 15kg of luggage whereas the international allows 40 kg it means international travellers be away. International connecting is allowed to carry 30kg on payment of RS. 6600. Even after paying RS 6600/- the passenger must pay extra RS 2000 if made 2 bags instead of 1 bag of 30kg. Travellers are charged for seat selection. ,Economy Class,1,no,359,3,3,2,1,Family Leisure,,Belgaum to Bangalore,April 2022,1,1,IndiGo,India
2022-04-19,"""Good budget airline""",8,"✅ Trip Verified |  Good budget airline. 15 kg check in and 7 kg cabin baggage included. On time departure and early arrival. Clean cabin, seat itch just as any LCC. Courteous cabin crew:",Economy Class,4,yes,360,2,4,,,Solo Leisure,A320 Neo,Delhi to Patna,April 2022,4,,IndiGo,India
2022-04-25,"""delayed by almost four hours""",2,"✅ Trip Verified |  I am 78 and my wife 68. We planned this trip to visit our daughter staying in UAE. Did'nt expect the experience will be so bad. This flight 6E 1407 on the 23rd April 2022 was supposed to fly from Lucknow India at 21:30 as per schedule. We were asked to board the flight. And then the wait started, at first they said some technical error we should be go to fly soon. But then it was delayed by almost four hours. People where seated in the aircraft with no air condition / no water to drink. The air hostess were helpless. The main reason for the delay was because the pilot who was supposed to fly this aircraft didn't turn up for some reason. So the airline decided to make us wait in the aircraft under these conditions ... is this acceptable? Indigo has been a good experience for me early. This was one experience that I faced recently.",Economy Class,3,no,361,1,1,1,,Family Leisure,,Lucknow to Sharjah,April 2022,2,,IndiGo,India
2022-04-28,"""Great customer service""",9,Not Verified |  Best airline ever. Great customer service. Pleasant staff. Super impressed. I was traveling with baby and toddler. They went above and beyond. I have been living in US and no airline was close to this.,Economy Class,5,yes,362,5,5,5,5,Family Leisure,,Mysore to Hyderabad,April 2022,5,5,IndiGo,India
2022-05-15,"""no guarantee that we will be seated together""",5,✅ Trip Verified |  For our flight (my husband n me) today evening at 5.45 pm I tried doing web check at about 10 am. I had no option to select a free seat together. Only way to ensure we sit together was if I bought seats - one middle one window or aisle. Cost of middle seat is minimum Rs 90/ and cost of aisle or window seat is minimal Rs 150 or max Rs 350. When I tried to web check in without seat selection message popped up in auto seat allotment- there is no guarantee that we will be seated together. The website gives no option of free seats together to choose.,Economy Class,2,no,363,3,5,4,4,Couple Leisure,,Guwahati to Bengaluru,May 2022,3,,IndiGo,India
2022-05-19,"""Uncalled for rescheduling and delay""",4,✅ Trip Verified |  Flight was rescheduled. Then on the changed connect flight there was a delay in departure from 16:55 to 17:35. Delay was not acknowledged or intimated or informed to us of the specific delay. Uncalled for rescheduling and delay of flights.,Economy Class,3,yes,364,3,4,,,Family Leisure,,Nagpur to Goa via Mumbai,May 2022,3,,IndiGo,India
